category,datetime,headline,id,image,related,source,summary,url,ticker,readable_datetime
company,1730296241,Google Cloud 'knocked it out of the park.' Is Microsoft Azure next?,130852717,https://s.yimg.com/ny/api/res/1.2/qiZl4CkGtlm0xKW73ByKng--/YXBwaWQ9aGlnaGxhbmRlcjt3PTEyMDA7aD02NzQ-/https://s.yimg.com/os/creatr-uploaded-images/2024-10/eacbdcc0-96c4-11ef-bee2-a8199c81ddcd,MSFT,Yahoo,"Alphabet (GOOG, GOOGL) shares climb higher after the Google parent company reported third quarter results that beat Wall Street’s expectations on the top and bottom lines adding confidence that the company’s artificial intelligence investments are paying off. Harvest Portfolio Management CIO and Wall Street Beats partner Paul Meeks joins Seana Smith and Brad Smith to break down the results. Meeks tells Yahoo Finance while he was ""favorable"" on the overall results, he was “disappointed in year-to-year revenue growth in digital ad sales of only 10%,” but “Google Cloud absolutely knocked it out of the park, growing 35% year-to-year.” The portfolio manager says that results from other cloud hyperscalers, namely Amazon (AMZN) Web Services, Microsoft (MSFT) Azure, and Oracle (ORCL) Cloud infrastructure, may show that Google Cloud took market share. Alphabet’s new CFO Anat Ashkenazi emphasized cutting costs as a key priority, especially as the company continues to invest in AI. Meeks says, “You want to have a CFO spending on the right things but not spending foolishly. So that comment that she made was right out of central casting.” To watch more expert insights and analysis on the latest market action, check out more Morning Brief here. This post was written by Naomi Buchanan.",https://finnhub.io/api/news?id=4e4eca998f2aff96773dd70f46bf6f6301b8f62a9536e9eab2fece2fff714705,MSFT,2024-10-30 13:50:41
company,1730295278,"Alphabet’s Pricey AI Bet Pays Off With Cloud, Search Growth",130852726,https://s.yimg.com/ny/api/res/1.2/36rRJomJJxf8WYxT0uL.sQ--/YXBwaWQ9aGlnaGxhbmRlcjt3PTEyMDA7aD02NTc-/https://media.zenfs.com/en/bloomberg_markets_842/a24ae5da698ecb440973ca393b64f2a1,MSFT,Yahoo,"(Bloomberg) -- Google parent Alphabet Inc. is showing an expensive foray into artificial intelligence is starting to pay off, delivering better-than-expected sales for its cloud-computing business and driving more usage of its flagship search engine.Most Read from BloombergNY Transit Agency Takes Next Step on Brooklyn-Queens Rail LinkThere Will Soon Be No Meatpackers Left in NYC’s Historic Meatpacking DistrictA South Korean City Plays Matchmaker to Tackle a Fertility CrisisInside NYC’s Playbook",https://finnhub.io/api/news?id=58cb0f3790c596fb501736204f86d28991859c4b481b612db6fb488bb51f7d69,MSFT,2024-10-30 13:34:38
company,1730294035,"Microsoft and Meta, Eli Lilly, US GDP in Q3: 3 Things",130852728,https://s.yimg.com/ny/api/res/1.2/RVr2PvKV7nbwXJ9XjCG0FQ--/YXBwaWQ9aGlnaGxhbmRlcjt3PTEyMDA7aD02NzY-/https://s.yimg.com/os/creatr-uploaded-images/2024-10/c04e0300-96c0-11ef-bfff-802ebd59ecd1,MSFT,Yahoo,"Google-parent Alphabet (GOOG, GOOGL) and chip giant Advanced Micro Devices (AMD) both reported their respective earnings results after Tuesday's market close. The Big Tech earnings train continues with Magnificent Seven members Microsoft (MSFT) and Meta Platforms (META) to come out with results after the bell today. Eli Lilly (LLY) shares tumble in pre-market trading after missing third quarter earnings estimates and cutting its guidance as sales of GLP-1 weight-loss drugs fall short of Wall Street expectations. Initial readings on US GDP (gross domestic product) see expansions of 2.8% in the third quarter, just shy of economist estimates for a 2.9% quarter-over-quarter rise. To watch more expert insights and analysis on the latest market action, check out more Morning Brief here. This post was written by Luke Carberry Mogan.",https://finnhub.io/api/news?id=328b5af87bb764fa6899e3edb831fe4dc452b98f39807d116e5322e2d28d72f5,MSFT,2024-10-30 13:13:55
company,1730290706,"Meta to report Q3 earnings with AI, ad sales in focus",130852731,https://s.yimg.com/ny/api/res/1.2/Q3tVp4PQDLZ2dMwMY.PnLA--/YXBwaWQ9aGlnaGxhbmRlcjt3PTEyMDA7aD04MDA-/https://s.yimg.com/os/creatr-uploaded-images/2024-10/4587f380-9637-11ef-9de4-3a147df5bd84,MSFT,Yahoo,Meta will report its Q3 earnings after the bell on Wednesday.,https://finnhub.io/api/news?id=0641964d119b1402d22cf685fa9f13d8d16fbee0820fe7760c1fea2b1b0fc1d7,MSFT,2024-10-30 12:18:26
company,1730290590,Microsoft to announce fiscal Q1 earnings as AI revenue remains top of mind,130852732,https://s.yimg.com/ny/api/res/1.2/1.g6TBAK.gSf9m1puFS_Gw--/YXBwaWQ9aGlnaGxhbmRlcjt3PTEyMDA7aD04MDA-/https://s.yimg.com/os/creatr-uploaded-images/2024-07/db59f510-4de5-11ef-9fe3-90d92ebd221a,MSFT,Yahoo,Microsoft will report its first quarter earnings after the bell on Wednesday.,https://finnhub.io/api/news?id=cb4d7f6df223ddbbf4ad1c0627f2f098bcd624433aadd46c954f0d2aa1f9f3a0,MSFT,2024-10-30 12:16:30
company,1730286180,"Google Sets High AI Bar for Big Tech Earnings, Microsoft, Others May Struggle. And 5 Other Things to Know Today.",130854977,,MSFT,Yahoo,"Reddit and Snap beat expectations as users increase, Bitcoin close to a record as U.S. election nears, and more news to start your day.",https://finnhub.io/api/news?id=69c2604d5557623fd707ff9ccd39e37f84dea0889f58307b95aea3ab41d7ebeb,MSFT,2024-10-30 11:03:00
company,1730284876,"Trending tickers: Alphabet, AMD, Microsoft, Reddit and Snap",130848125,https://s.yimg.com/ny/api/res/1.2/kL5JdlwnfUTngYB0kEnheA--/YXBwaWQ9aGlnaGxhbmRlcjt3PTEyMDA7aD03NzE-/https://s.yimg.com/os/creatr-uploaded-images/2024-10/8d47b120-96a9-11ef-9ffd-9d09ce3dc26e,MSFT,Yahoo,The latest investor updates on stocks that are trending on Wednesday.,https://finnhub.io/api/news?id=6eadbef6fc2e22fbddcc40ef28f04154b998f11d4209cbdae8222ddaffdcca72,MSFT,2024-10-30 10:41:16
company,1730284396,EY launches Competitive Edge platform for tailored market insights,130855414,https://www.internationalaccountingbulletin.com/wp-content/uploads/sites/9/2024/10/EY-Competitive-Edge-shutterstock_2256239267.jpg,MSFT,Yahoo,"Central to the platform is an AI-driven engine that incorporates Microsoft's GenAI technologies, enhanced by exclusive algorithms.",https://finnhub.io/api/news?id=39b97c0174c86cbb005aa5163e111c55cf578defbc6ed5081b83584e7f8d2887,MSFT,2024-10-30 10:33:16
company,1730284138,"Stock Market Today: Stocks higher on Google boost; Meta, Microsoft on deck",130854984,,MSFT,Yahoo,"The first of a five megacap tech earnings delivered for Wall Street, with Alphabet shares driving early gains ahead of updates from Meta and Microsoft.",https://finnhub.io/api/news?id=387cc3f063d27356990d4f9eba0029a63020cbed42e89ba8685bdcee8a583398,MSFT,2024-10-30 10:28:58
company,1730282741,S&P 500: Mean Reversion Always Wins In The End,130852198,https://static.seekingalpha.com/cdn/s3/uploads/getty_images/123496124/image_123496124.jpg?io=getty-c-w1536,MSFT,SeekingAlpha,A market correction looms as the bond market sends caution signals. Read here for details.,https://finnhub.io/api/news?id=ffa308a1dcc564ae4ddc21745ea22ea48e0e80240705cf23e24d3cf181c0fe7d,MSFT,2024-10-30 10:05:41
company,1730282424,Why this bull market feels 'weird': Morning Brief,130850220,https://s.yimg.com/ny/api/res/1.2/7tuDtQoGapqBkHBoTM8K2A--/YXBwaWQ9aGlnaGxhbmRlcjt3PTEyMDA7aD04Mzc-/https://s.yimg.com/os/creatr-uploaded-images/2021-05/a2deb910-ad01-11eb-95e7-35d4dc58ae8a,MSFT,Yahoo,The economy is making a soft landing and the bull market is flying high as the Nasdaq hits record heights. But the mood is...off.,https://finnhub.io/api/news?id=62596b84bf3c92cb2ff5d57b4c06f3f9136e6ad1d16ea4ec001308d6c290260e,MSFT,2024-10-30 10:00:24
company,1730280600,Google Looks More to What It Can Control,130853697,,MSFT,Yahoo,"Google might be the largest company in the world whose fate seems completely out of its hands these days, but the $2 trillion internet giant still has a few cards it can play.  Revenue and operating income beat Wall Street’s estimates thanks to strength in the company’s core search business and its cloud-computing operation.  Google Cloud’s revenue jumped 35% year over year, up 6 percentage points from the growth rate shown in the last quarter and the best for the unit in two years.",https://finnhub.io/api/news?id=18130d8038afee26478ae7c52e20945ce1b34a0930e94e8c9cdad3c3cac64e36,MSFT,2024-10-30 09:30:00
company,1730279580,"Billionaire Jeff Yass' Susquehanna Just Reduced Its Position in Nvidia by 73%, and Is Buying This Other Artificial Intelligence (AI) Chip Stock Like There's No Tomorrow",130846583,https://g.foolcdn.com/editorial/images/795283/gettyimages-1358049863-2.jpg,MSFT,Yahoo,Susquehanna Investment Group trimmed its stake in Nvidia while increasing its position in Micron by 271%.,https://finnhub.io/api/news?id=b3ccc365d02a63ae981c701583c9e26259f4c307529131cb3a46ed25ba1c0960,MSFT,2024-10-30 09:13:00
company,1730279383,FTSE 100 and European markets lower as markets hold breath for budget,130847567,https://s.yimg.com/ny/api/res/1.2/Dx6YLcJYiyYpqs2Lhcfv6g--/YXBwaWQ9aGlnaGxhbmRlcjt3PTEyMDA7aD04MDA-/https://s.yimg.com/os/creatr-uploaded-images/2024-10/b03d3a20-9699-11ef-9ffa-b01449257bb8,MSFT,Yahoo,The slew of policy announcements due from chancellor Rachel Reeves will set the tone for markets in London today.,https://finnhub.io/api/news?id=5560b5c73db904d643aea183d15b5126b0f48bc69cfb14921b9904f366886483,MSFT,2024-10-30 09:09:43
company,1730275978,Google's Strong Q3 Earnings: What It Means For Your Portfolio Strategy,130850374,https://static.seekingalpha.com/cdn/s3/uploads/getty_images/1169427542/image_1169427542.jpg?io=getty-c-w1536,MSFT,SeekingAlpha,"Google has shown strong Q3 2024 earnings results, announcing EPS of $2.12, up 37% vs. the same quarter of the previous year. Find out why GOOG stock is a Strong Buy.",https://finnhub.io/api/news?id=96f77830e3ca20c3c1f5422f345ac53561a7da37484e9e94aa5105264e3b3625,MSFT,2024-10-30 08:12:58
company,1730274768,Google Gets No Respect From Wall Street: Still The Best Buy In Tech,130849952,https://static.seekingalpha.com/cdn/s3/uploads/getty_images/1973219917/image_1973219917.jpg?io=getty-c-w1536,MSFT,SeekingAlpha,Google trades for a lower P/E than the market but has superior and long-lasting earnings growth. Learn why GOOG stock is a Buy.,https://finnhub.io/api/news?id=b71743c3cccbbd5c494c0582b7eaaf21dc3b085d14f019e403766c0aa9e07b0f,MSFT,2024-10-30 07:52:48
company,1730269859,"Microsoft: Beyond AI And Cloud, There Is A $30B Business",130847961,https://static.seekingalpha.com/cdn/s3/uploads/getty_images/1153246305/image_1153246305.jpg?io=getty-c-w1536,MSFT,SeekingAlpha,"While AI and Cloud represent two cornerstones of Microsoft, a third segment is often overlooked. Check out the More Personal Computing segment of MSFT stock.",https://finnhub.io/api/news?id=ccf89ff93773af1f82c0906b5f46972c06fcdc2a0e2e4ab3f0a887514d8a0cb7,MSFT,2024-10-30 06:30:59
company,1730264400,"AI, Data Centers And Energy Demand",130846308,https://static.seekingalpha.com/cdn/s3/uploads/getty_images/1338344120/image_1338344120.jpg?io=getty-c-w1536,MSFT,SeekingAlpha,"Why Jennifer Warren has been focusing onÂ AI, data centers and energy demand. Click here for a detailed analysis.",https://finnhub.io/api/news?id=32fa5d2c3d16ad5da4403238f1efe7686005e3ced3e10f331d0c0f7d2799b9e3,MSFT,2024-10-30 05:00:00
