category,datetime,headline,id,image,related,source,summary,url,ticker,readable_datetime
company,1730409284,"Why Amazon stock gains on earnings, unlike Meta and Microsoft",130923223,https://s.yimg.com/ny/api/res/1.2/ND_KDuCdDauXR9i2BMaOsw--/YXBwaWQ9aGlnaGxhbmRlcjt3PTEyMDA7aD02NzY-/https://s.yimg.com/os/creatr-uploaded-images/2024-10/d98816d0-97c9-11ef-a3ff-664c6e3b448f,MSFT,Yahoo,"Amazon (AMZN) reported better-than-expected third quarter results and delivered strong guidance. CFRA Research senior equity research analyst Arun Sundaram joins Market Domination Overtime Hosts Alexandra Canal and Josh Lipton to discuss the results and break down why the market is less concerned with Amazon’s artificial intelligence (AI) spending compared to its peers. “Really, you got the you got the ingredients you needed for the stock to go up,” Sundaram says. The analyst explains that while all the cloud hyperscalers are ramping up their capital spending to invest in AI, investors seem less concerned about Amazon’s AI spending compared to Meta (META) and Microsoft (MSFT). He says, “There's a few unique things” with Amazon,” including “Amazon's not solely reliant on chips from Nvidia” as “ they also build and create their own AI chips that are more cost-effective and of more value. So they may not be seeing the same type of capacity constraint issues that Microsoft is seeing at the moment.” Sundaram notes, “The other thing I would point out too is, you know, Amazon has multiple levers to grow margins,” including their e-commerce business, advertising, Amazon Web Services, and other segments. To watch more expert insights and analysis on the latest market action, check out more Market Domination Overtime here. This post was written by Naomi Buchanan.",https://finnhub.io/api/news?id=d674a90594a2f857cce2d6d01a94114ab17bad6635f22306961ea49f329b2056,MSFT,2024-10-31 21:14:44
company,1730408700,"These Stocks Moved the Most Today: Microsoft, Meta, Super Micro, Uber, Carvana, Estée Lauder, Robinhood, Peloton, Li Auto, and More",130918569,,MSFT,Yahoo,"Microsoft issues lower-than-expected second-quarter revenue guidance, while Meta Platforms expects rising infrastructure expenses next year. Apple and Amazon.com are scheduled to report earnings after the closing bell Thursday.",https://finnhub.io/api/news?id=017d5eef18e819b10d0269029c27f1bd5e4069562b0f1ed085ff40d88b7dbb36,MSFT,2024-10-31 21:05:00
company,1730407816,Thursday Slump Wipes Out S&P 500's Monthly Winning Streak,130921879,https://media.zenfs.com/en/wsj.com/7b2c285183be07ca3c4e8242b25a59a8,MSFT,Yahoo,"The stock market's monthly winning streak is over.  After falling 1.9% Thursday, the broad market index finished October down 1% for the month.  A gain in October would have marked the index's longest winning streak in more than three years.",https://finnhub.io/api/news?id=f492aeeb21a1c82c51c634422c79b23ec698bc4ebd8b0df31c416d5914fd287f,MSFT,2024-10-31 20:50:16
company,1730407281,OpenAI Rolls Out Enhanced Web Search Capability for ChatGPT Users,130934070,,MSFT,Yahoo,"Provides information on stocks, weather, sports, news, and maps",https://finnhub.io/api/news?id=f84429c9f68dad3d5a19b561b05a657450460c7ace9fa8083e4d1bd753103ca7,MSFT,2024-10-31 20:41:21
company,1730406626,"Equity Markets Log Declines for Thursday, October",130921881,https://s.yimg.com/cv/apiv2/social/images/yahoo_default_logo-1200x1200.png,MSFT,Yahoo,"Equity Markets Log Declines for Thursday, October",https://finnhub.io/api/news?id=f369ebbda05ec87b7b05da73110b2c50ddbd6e737009fa8bcc9537ca16b64290,MSFT,2024-10-31 20:30:26
company,1730406081,Will the Big Tech sell-off continue? This strategist says yes.,130921883,https://s.yimg.com/ny/api/res/1.2/urh5ob9b5BhI76tsr4shyQ--/YXBwaWQ9aGlnaGxhbmRlcjt3PTEyMDA7aD02NzU-/https://s.yimg.com/os/creatr-uploaded-images/2024-10/42589320-97c4-11ef-9f79-9a42fcc7d845,MSFT,Yahoo,"US stocks (^DJI,^GSPC, ^IXIC) are trading lower, with Big Tech leading the pullback after Meta (META) and Microsoft (MSFT) earnings fed into concerns about artificial intelligence (AI) spending. US SPDR Business at State Street Global Advisors chief investment strategist Michael Arone joins Market Domination Hosts Alexandra Canal and Josh Lipton to discuss his outlook for the Big Tech sector. “What's been happening is that these companies continue to beat on top and bottom line, yet their forecasts just aren't good enough given how far they've come from a price-performance perspective and where their valuations are,” Arone tells Yahoo Finance. The strategist adds, “I do expect this [Big Tech pullback] to continue to unfold, given some of the risks."" For more on Arone’s expectations for Big Tech stocks and how to navigate the pullback, watch the video above. To watch more expert insights and analysis on the latest market action, check out more Market Domination here. This post was written by Naomi Buchanan.",https://finnhub.io/api/news?id=26f8756a8d7c4d2391bb59d05597669113da6d21a4d2771c20d82a97b6a5ac6b,MSFT,2024-10-31 20:21:21
company,1730405759,"Nasdaq, S&P 500 sell off ahead of Amazon, Apple earnings",130914929,https://s.yimg.com/ny/api/res/1.2/cMcIGT_L_CCBbM7zpqm9IQ--/YXBwaWQ9aGlnaGxhbmRlcjt3PTEyMDA7aD02NzY-/https://s.yimg.com/os/creatr-uploaded-images/2024-10/ba3bfab0-97c1-11ef-99fe-f20e6fd60fe5,MSFT,Yahoo,"The tech-heavy Nasdaq Composite (^IXIC) closed Thursday over 2.7% lower, the S&P 500 (^GSPC) not too far behind with a session loss of 1.86%. Tech sector worries seem to have been revived coming off Meta Platforms (META) and Microsoft's (MSFT) latest earnings print and ahead of Amazon (AMZN) and Apple's (AAPL) results due out after the close. Yahoo Finance markets and data editor Jared Blikre joins Alexandra Canal and Josh Schafer on Market Domination Overtime to examine bond market trends (^TYX, ^TNX, ^FVX) and losses from Magnificent Seven tech leaders. To watch more expert insights and analysis on the latest market action, check out more Market Domination Overtime here. This post was written by Luke Carberry Mogan.",https://finnhub.io/api/news?id=fdab985ca8da754d909ca1f481978a3a3264619c328425e05104c6eb7bf49f18,MSFT,2024-10-31 20:15:59
company,1730405532,"Intel stock jumps on positive outlook, despite Q3 losses",130914852,https://s.yimg.com/ny/api/res/1.2/wu68ZdXbbCLF2vtOnGi_yg--/YXBwaWQ9aGlnaGxhbmRlcjt3PTEyMDA7aD03OTk-/https://s.yimg.com/os/creatr-uploaded-images/2024-10/5c6655b0-9790-11ef-8eac-b1d77bd6c8c1,MSFT,Yahoo,Shares of Intel jumped Thursday after the company said it anticipates better than expected revenue for Q4.,https://finnhub.io/api/news?id=a492aac46a26d07c16571b30076baadbf254459c4b26913152a2ff757e241ac1,MSFT,2024-10-31 20:12:12
company,1730320284,Microsoft Cloud Fuels Stronger-Than-Expected Revenue Growth,130864727,https://s.yimg.com/ny/api/res/1.2/Xu7iuna4URmNzrYdeFoTxQ--/YXBwaWQ9aGlnaGxhbmRlcjt3PTEyMDA7aD02ODA-/https://media.zenfs.com/en/bloomberg_technology_68/6887938fe160a3bb627dd2db343dab8f,MSFT,Yahoo,"(Bloomberg) -- Microsoft Corp.’s cloud-computing and Office software businesses fueled stronger-than-projected quarterly revenue growth, a sign that the company’s hefty investments in artificial intelligence are starting to pay off.Most Read from BloombergNY Transit Agency Takes Next Step on Brooklyn-Queens Rail LinkIs Denver’s Big Bet on E-Bikes Paying Off?There Will Soon Be No Meatpackers Left in NYC’s Historic Meatpacking DistrictChicago Mayor Seeks Property Tax Hike, Breaking Campaign VowA S",https://finnhub.io/api/news?id=78f8cba3da6c0035aa97afc0f3496892338e6d1e3916958034dfdfbc3e845669,MSFT,2024-10-30 20:31:24
company,1730405019,"US Equities Markets End Lower Thursday Ahead of Apple, Amazon Earnings",130934108,https://s.yimg.com/cv/apiv2/social/images/yahoo_default_logo-1200x1200.png,MSFT,Yahoo,"US Equities Markets End Lower Thursday Ahead of Apple, Amazon Earnings",https://finnhub.io/api/news?id=49f115d8a3effa47880b6ceaf5e0e6a93222f6a4153a73d23531316fc7490291,MSFT,2024-10-31 20:03:39
company,1730399627,Squirrelly Action Is One Reason To Watch Nvidia. Here Are 5 More.,130910448,,MSFT,Yahoo,"As Nvidia stock comes under pressure, here are five more reasons to watch the AI giant, plus one caveat for investors.",https://finnhub.io/api/news?id=2b6c9096c64fc9011e6ba6fa264ace60bb77f68167d169ffef2d71848f7e71c3,MSFT,2024-10-31 18:33:47
company,1730404734,Nvidia Is Falling Today -- Is This an Opportunity to Buy the Artificial Intelligence (AI) Stock?,130925753,https://g.foolcdn.com/editorial/images/796098/gettyimages-1550670587.jpg,MSFT,Yahoo,Are Nvidia investors having the wrong reaction to recent earnings reports from Microsoft and Meta Platforms?,https://finnhub.io/api/news?id=409cd769ff336d18cc3fa46f74c5329d1135f1521d4d101473258ec4d9deca8d,MSFT,2024-10-31 19:58:54
company,1730404425,"Equity Markets Lower Ahead of Apple, Amazon Earnings",130934118,https://s.yimg.com/cv/apiv2/social/images/yahoo_default_logo-1200x1200.png,MSFT,Yahoo,"Equity Markets Lower Ahead of Apple, Amazon Earnings",https://finnhub.io/api/news?id=4add7ff964ec2a7df09d9fec1e891784816a11ca373c846d3eade74e330cecfd,MSFT,2024-10-31 19:53:45
company,1730402389,Amazon Q3: Double Beat Makes Shares Jump,130923916,https://static.seekingalpha.com/cdn/s3/uploads/getty_images/1452541809/image_1452541809.jpg?io=getty-c-w1536,MSFT,SeekingAlpha,"Amazon.com, Inc.'s Q3 earnings beat expectations but showed weaker business growth compared to competitors. Click for my AMZN stock update.",https://finnhub.io/api/news?id=7efe08fc36506548b55d8d947fcf453c6faf1c8fdede2a34807a3a7804fd279c,MSFT,2024-10-31 19:19:49
company,1730402200,"Apple Earnings: Q4 Results Decent, But Questions Continue Into Q1 2025",130923740,https://static.seekingalpha.com/cdn/s3/uploads/getty_images/108108888/image_108108888.jpg?io=getty-c-w1536,MSFT,SeekingAlpha,Apple reported Q4 2024 results that slightly beat estimates and provide some relief at face value. Click here to read an analysis of AAPL stock now.,https://finnhub.io/api/news?id=7ed7ae52f70f352951a11837ba2c92c4e2f017bbd4c1b51a0b7cf339ce75a5ea,MSFT,2024-10-31 19:16:40
company,1730399400,Tech Stocks: Staying Ahead Of The Curve,130922682,https://static.seekingalpha.com/cdn/s3/uploads/getty_images/1288440805/image_1288440805.jpg?io=getty-c-w1536,MSFT,SeekingAlpha,What happens when growth numbers for tech names start coming down? Joe Albano and Victor Dergunov dissect recent news and how the Presidential election will affect the sector.,https://finnhub.io/api/news?id=f3e055aff3f52515026fa9c78240d109853e792676ca3afcc7928c820f487d32,MSFT,2024-10-31 18:30:00
company,1730396993,Tech Down as AI Enthusiasm Wanes -- Tech Roundup,130919879,,MSFT,Finnhub,Shares of technology companies fell sharply as the sheen continued to come off artificial-intelligence stocks. Shares of Microsoft slid about 6% after the software giant's sales projection for the...,https://finnhub.io/api/news?id=70bbae21420692f5c44d2f13743458a0fcdc62e3516f4ead3000e10976406ce4,MSFT,2024-10-31 17:49:53
company,1730389446,Microsoft : Earnings Release FY25 Q1,130912669,,MSFT,Finnhub,"Microsoft Cloud Strength Drives First Quarter Results REDMOND, Wash. - October 30, 2024 - Microsoft Corp. today announced the following results for the quarter ended September...",https://finnhub.io/api/news?id=0efc85d6531b900fc4ace1bbbc7810dce7d6903d7b73768324338c1413efc5e5,MSFT,2024-10-31 15:44:06
company,1730386680,Wall Street Lunch: Tech Stocks That Go Bump In The Night,130910217,https://static3.seekingalpha.com/assets/podcasts/wsb-d57bf915fd82bac19817953c2e226c7610de9fc3a36c166d7c276e18e86311ea.png,MSFT,SeekingAlpha,Guidance from Microsoft and Meta spark a spooky selloff. The Fed's favorite inflation gauge ticks up. EstÃ©e Lauder slashes its dividend.,https://finnhub.io/api/news?id=2ab9881d408dadb45bbb3187bbe0c37244ec43a38538df6306245bb5b402ad42,MSFT,2024-10-31 14:58:00
company,1730383092,OpenAI adds new search function to ChatGPT,130907420,,MSFT,Finnhub,"OpenAI on Thursday added a set of new search functions to its popular large language model ChatGPT, opting to integrate the feature into the chatbot instead of launching a separate product. ...",https://finnhub.io/api/news?id=b0511d829386035c6deb945296b3da3fb1f3de95f5c7395e9a37c29362977323,MSFT,2024-10-31 13:58:12
company,1730381869,Microsoft Sell-Off? I'm Buying It! Avoid These 3 Misconceptions,130906792,https://static.seekingalpha.com/cdn/s3/uploads/getty_images/1509310383/image_1509310383.jpg?io=getty-c-w1536,MSFT,SeekingAlpha,"Discover why recent sell-offs of Microsoft are based on misconceptions and why it remains a highly profitable, innovative company with strong growth. Learn more on MSFT here.",https://finnhub.io/api/news?id=51b381c6a1d36e970fad93751e94bc69d94dd8a691cab41bb043b7d82201c51c,MSFT,2024-10-31 13:37:49
company,1730376000,Nvidia: You Haven't Seen Anything Yet,130902703,https://static.seekingalpha.com/cdn/s3/uploads/getty_images/1412721464/image_1412721464.jpg?io=getty-c-w1536,MSFT,SeekingAlpha,"Nvidia Corporation's growth opportunities currently exceed the existing risks, and its stock has a potential to appreciate even further in the upcoming months. Read more here.",https://finnhub.io/api/news?id=6a8cf7c43d41c3a76de5bc93a5f69f6eeca4c8492ca120dec625c50d44f7a6d0,MSFT,2024-10-31 12:00:00
company,1730374243,XLK: Google's Q3 Shows Why Investors Must Own Tech Stocks,130901020,https://static.seekingalpha.com/cdn/s3/uploads/getty_images/1643360144/image_1643360144.jpg?io=getty-c-w1536,MSFT,SeekingAlpha,The XLK has an outstanding long-term performance track record that has beaten the returns of the QQQs by 120%+ over the past decade. Read more here.,https://finnhub.io/api/news?id=93e163e81e3d5662a020ab895b035ca4dca3f5cadd62ee4480aa2c1fd3193a95,MSFT,2024-10-31 11:30:43
company,1730368117,Google's Path To $200 Depends On This Missing Piece To Its AI Puzzle,130898623,https://static.seekingalpha.com/cdn/s3/uploads/getty_images/1163973538/image_1163973538.jpg?io=getty-c-w1536,MSFT,SeekingAlpha,"Google's AI investments show impressive growth in Q3 2024, with Google Cloud outperforming and ad revenue staying strong. Read more here.",https://finnhub.io/api/news?id=ba2408df4d2eb41452fa1dcb035050a7e9b9072b9bcc48862dc2dbd3c300cc94,MSFT,2024-10-31 09:48:37
company,1730366185,AMD Q3: Buy The Dip As Data Center Growth Is What Counts,130897450,https://static.seekingalpha.com/cdn/s3/uploads/getty_images/620925371/image_620925371.jpg?io=getty-c-w1536,MSFT,SeekingAlpha,"AMD's Q3 revenue reached $6.8 billion, beating estimates, with Data Center revenue up 122% year-over-year, driven by AI demand. Explore more details here.",https://finnhub.io/api/news?id=e4780b80fb7452f4435ce34dbea6659df9b681a3e3f6a3735ab7fe7f063b8298,MSFT,2024-10-31 09:16:25
company,1730361600,"Microsoft: Q1-FY2025 Review, Double Beat Fails To Justify Rich Valuation",130895135,https://static.seekingalpha.com/cdn/s3/uploads/getty_images/1509310383/image_1509310383.jpg?io=getty-c-w1536,MSFT,SeekingAlpha,"Despite beating top and bottom line estimates for Q1 FY2025, Microsoft is down -4% in after-hours trading. See why I remain neutral on MSFT stock.",https://finnhub.io/api/news?id=aca46735879eb4dfab5fae843be0d7a632c23aa3b4571d32772c55216ecbc1bd,MSFT,2024-10-31 08:00:00
company,1730354126,Microsoft: EPS up 10% in Q1,130890369,,MSFT,Finnhub,"On Wednesday evening, Microsoft reported a 10% increase in EPS to $3.30 and a 14% increase in operating profit to $30.6 billion for the first three months of its 2024-25 fiscal year, on revenues up...",https://finnhub.io/api/news?id=e4dd39f4f16970ce4bb431e00488e38d48dd01516502219cea76d28895a506b0,MSFT,2024-10-31 05:55:26
company,1730345056,"SoftwareOne appoints new CEO, cuts revenue growth forecasts",130885686,,MSFT,Finnhub,SoftwareOne on Thursday said it appointed Raphael Erb as CEO from Nov. 1 as the Swiss company slashed its full-year revenue growth forecast on a weaker-than-expected third quarter. The...,https://finnhub.io/api/news?id=a2ee4b35e5c5f386aaf10108f1b8352a723ea80c3e4c8143aa460f5353fd34d6,MSFT,2024-10-31 03:24:16
company,1730319847,Microsoft Corporation (MSFT) Q1 2025 Earnings Call Transcript,130871320,https://static.seekingalpha.com/assets/og_image_1200-29b2bfe1a595477db6826bd2126c63ac2091efb7ec76347a8e7f81ba17e3de6c.png,MSFT,SeekingAlpha,"Microsoft Corporation (NASDAQ:MSFT) Q1 2025 Results Conference Call October 30, 2024 5:30 PM ETCompany ParticipantsBrett Iversen - Vice President of...",https://finnhub.io/api/news?id=a51e30e9d9df9753751c741e2ee33479ffa5dd4ab77d4703d1d66593b8a5f083,MSFT,2024-10-30 20:24:07
company,1730317512,"Stocks to Watch : Microsoft, Etsy, Root, Nextracker",130870146,,MSFT,Finnhub,By Connor Hart Microsoft reported strong quarterly growth in its cloud-computing business -- a sign its artificial intelligence investments are paying off -- but guided for lower-than-expected...,https://finnhub.io/api/news?id=ae7ced5a8e1f615a42022bf99f8d580b477d14aa4b23d448c5cfb4110f027fab,MSFT,2024-10-30 19:45:12
company,1730314372,Microsoft Q1: Strong Cloud Growth Driven By AI Demands,130869086,https://static.seekingalpha.com/cdn/s3/uploads/getty_images/1310441327/image_1310441327.jpg?io=getty-c-w1536,MSFT,SeekingAlpha,Microsoft is well-positioned for market growth with strong cloud performance. Learn why MSFT stock holds a Strong Buy rating and a target of $550 per share.,https://finnhub.io/api/news?id=01e3801ae9921c461cd50f4eb0a831748b73f73c1647b7a07aff3b59f7c57fe7,MSFT,2024-10-30 18:52:52
company,1730311384,"Google Pops On Great Results, The Prospect Of Cloud Growth",130867424,https://static.seekingalpha.com/cdn/s3/uploads/getty_images/1181670972/image_1181670972.jpg?io=getty-c-w1536,MSFT,SeekingAlpha,Ongoing improvements in Alphabet Inc.'s cloud services have led to a surge in revenue and earnings. Click here to read my GOOG Q3 earnings update.,https://finnhub.io/api/news?id=d065e93a400fce3ac8e3ee2f1a8bbd57161de8a5c787f41f662f9823790e0127,MSFT,2024-10-30 18:03:04
company,1730307290,Microsoft reports $65.6 billion in quarterly sales as investors look to know if AI spending worth it,130864544,,MSFT,Finnhub,Microsoft on Wednesday reported an 11% increase in profit for the July-September quarter compared to the same time last year as investors looked for signs that the company's huge spending on...,https://finnhub.io/api/news?id=00c64d5df52db522821c054c2bd60e38724534d2c31a9dfa6c3f535e39785ecc,MSFT,2024-10-30 16:54:50
company,1730304569,Microsoft : Cloud Strength Drives First Quarter Results Form 8 K,130862982,,MSFT,Finnhub,"Microsoft Cloud Strength Drives First Quarter Results REDMOND, Wash. - October 30, 2024 - Microsoft Corp. today announced the following results for the quarter ended September 30,...",https://finnhub.io/api/news?id=1c633617abceee6c9eee32b001aaea5199760e38cc5974d6c6a653c41355127a,MSFT,2024-10-30 16:09:29
company,1730304425,Microsoft earnings press release available on Investor Relations website,130862434,,MSFT,Finnhub,"REDMOND, Wash., Oct. 30, 2024 /PRNewswire/ -- Microsoft Corp. on Wednesday announced that fiscal year 2025 first-quarter financial results are available on its Investor Relations website. The direct...",https://finnhub.io/api/news?id=43ca672742abd018cfe8514ee6fd6800d79bf43f0487004477a0e8cc08d282a6,MSFT,2024-10-30 16:07:05
company,1730304309,Why investors should buy the Mag 7 'right now',130854954,https://s.yimg.com/ny/api/res/1.2/0SWCMyitkaPjI45KQdqV5A--/YXBwaWQ9aGlnaGxhbmRlcjt3PTEyMDA7aD02NzQ-/https://s.yimg.com/os/creatr-uploaded-images/2024-10/d7e1bab0-96d5-11ef-b217-eb0ec23153a4,MSFT,Yahoo,"Attention is turning to Microsoft (MSFT) and Meta Platforms (META) as the next members of the ""Magnificent Seven"" tech companies set to report their third quarter earnings. To discuss the outlook for these industry leaders, Howard Capital Management CEO and chief investment officer Vance Howard joins Wealth! Howard believes investors should be adding to all of the ""Magnificent Seven"" names, calling them ""the most interesting part of the market,"" even including Tesla (TSLA), despite its recent stumbles. ""Everybody worries about these 'Magnificent Seven', but they are leading this market higher and creating some of the most interesting and dynamic products and services,"" Howard states. He adds that these tech giants are ""making money hand over fist."" Regarding the transformative impact of artificial intelligence on these names, Howard drew an analogy to golf, saying that if we were on an 18-hole course, AI would still be ""on the very first hole."" While acknowledging there is still substantial work to be done in the AI space, Howard remains ""incredibly bullish"" on its long-term potential. To watch more expert insights and analysis on the latest market action, check out more Wealth here. This post was written by Angel Smith",https://finnhub.io/api/news?id=6d96bd492bf545a366375ade24b66de976c2bda7097ef223b547424c43aea721,MSFT,2024-10-30 16:05:09
company,1730304229,Microsoft beats quarterly revenue estimates,130862298,,MSFT,Finnhub,Microsoft beat Wall Street estimates for first-quarter revenue on Wednesday as efforts to build out data center capacity and AI-driven demand boosted its cloud business. Revenue rose 16%...,https://finnhub.io/api/news?id=d8b506aafe53fdc181cc23d41449556544d1137496b0ac561afead2786d44e73,MSFT,2024-10-30 16:03:49
company,1730280660,"These Stocks Are Moving the Most Today: Alphabet, AMD, Reddit, Snap, First Solar, Qorvo, Microsoft, and More",130848190,https://s.yimg.com/ny/api/res/1.2/yBB2BKFNZ47gxUWWH7Y2aA--/YXBwaWQ9aGlnaGxhbmRlcjt3PTEyMDA7aD02MDA-/https://media.zenfs.com/en/Barrons.com/802e0fda111255f6949b7d83c2de39a2,MSFT,Yahoo,"Alphabet tops third-quarter earnings and revenue expectations as cloud revenue surges 35%, Advanced Micro Devices issues a disappointing fourth-quarter revenue forecast, and Reddit posts its first profitable quarter since going public. Microsoft and Meta Platforms are scheduled to report earnings later Wednesday.",https://finnhub.io/api/news?id=4830e9e232f8acb9cbbd7a6dffc97327a2928799b41fdd2226d4b9b98096d997,MSFT,2024-10-30 09:31:00
company,1730298897,"Microsoft, Meta to Feel AI Scrutiny as Investors Wait for Payoff",130854956,https://media.zenfs.com/en/bloomberg_markets_842/423de8100e9ad077d277a30fe1c7540d,MSFT,Yahoo,(Bloomberg) -- Ever-growing scrutiny from investors over when the billions spent on artificial intelligence will flow through to sales and profit is set to dominate when Microsoft Corp. and Meta Platforms Inc. report earnings later Wednesday. Most Read from BloombergNY Transit Agency Takes Next Step on Brooklyn-Queens Rail LinkThere Will Soon Be No Meatpackers Left in NYC’s Historic Meatpacking DistrictA South Korean City Plays Matchmaker to Tackle a Fertility CrisisInside NYC’s Playbook for Get,https://finnhub.io/api/news?id=4801c229ca2c093154339f4ff1681e761e62fc05d506cefc9c348a45aed8097e,MSFT,2024-10-30 14:34:57
company,1730298780,Activision Blizzard: What Microsoft Got for $69 Billion,130855379,https://g.foolcdn.com/editorial/images/795627/mfm_26.jpg,MSFT,Yahoo,"Last year, Microsoft closed its takeover of Activision Blizzard. In the months that followed, interest rates rose, expectations changed, and Microsoft Gaming eliminated 8% of its workforce.",https://finnhub.io/api/news?id=9053fc843662cb01ec3a938d2a6272b6baaae1f02138f451fc2d1997b26e6a41,MSFT,2024-10-30 14:33:00
company,1730298108,"Google's capex spending is growing 60%, which is good news for NVIDIA",130852715,https://s.yimg.com/cv/apiv2/social/images/yahoo_default_logo-1200x1200.png,MSFT,Yahoo,"Investing.com --- Google parent Alphabet (NASDAQ:GOOGL) highlighted with its third quarter earnings report Tuesday night that it spent $13.1 billion on capex in the quarter, up 62% from the $8.1 billion spent in the same quarter last year. Further, Google expects to spend the same amount on capex in the fourth quarter. All in, this suggests Google’s 2024 total capex spending of $51.4 billion, up 59% from last year. Looking to 2025, Google said capex will again increase but not at the same level.",https://finnhub.io/api/news?id=b426173b8278233b4f5ff7489c0b074368175d6812457822c5f79b2e3a577f0d,MSFT,2024-10-30 14:21:48
company,1730298012,Microsoft Corporation (MSFT): Among UBS’ Top Tech Based Disruptive Stocks For 2030,130855382,https://s.yimg.com/ny/api/res/1.2/Ehrz1CBybY_oskwS2bSRJQ--/YXBwaWQ9aGlnaGxhbmRlcjt3PTEyMDA7aD02NzM-/https://media.zenfs.com/en/insidermonkey.com/ae3cb2a93ad8e5ddf6f94148e71f74b9,MSFT,Yahoo,"We recently compiled a list of the UBS’ Top Tech Based Disruptive Stocks For 2030: Top 29 Stocks. In this article, we are going to take a look at where Microsoft Corporation (NASDAQ:MSFT) stands against the other tech based disruptive stocks. When it comes to investing and making massive gains on the stock market, disruption is […]",https://finnhub.io/api/news?id=4a2c6e80c12fd37103639a6be1f2667cc0ab798cdcbb1cf6d69e234800eaa3be,MSFT,2024-10-30 14:20:12
