category,datetime,headline,id,image,related,source,summary,url,ticker,readable_datetime
company,1730545200,"CVS Health, Apollo Global Management, And Novo Nordisk Reported Results",131005101,https://static.seekingalpha.com/assets/og_image_1200-29b2bfe1a595477db6826bd2126c63ac2091efb7ec76347a8e7f81ba17e3de6c.png,MSFT,SeekingAlpha,"Stay ahead of the market with Seeking Alpha's Wall Street Week Ahead newsletter, previewing key events like elections, Fed meeting, earnings reports.",https://finnhub.io/api/news?id=477d5326bc38b8768974f5eee7ce3cb2f9f8a50ca8c44d5e39d7756ced932df4,MSFT,2024-11-02 11:00:00
company,1730538000,"Energy Additions, Not Transitions And Navigating A Trump Or Harris Win",131003742,https://static.seekingalpha.com/cdn/s3/uploads/getty_images/856558990/image_856558990.jpg?io=getty-c-w1536,MSFT,SeekingAlpha,Diving deep into the energy sector with Laura Starks; how the U.S. became the top oil producer.,https://finnhub.io/api/news?id=028a66cb9a4c8f77d830e878de58860a97b250f3a7668fc1105210910c2474fe,MSFT,2024-11-02 09:00:00
company,1730527887,Decarbonization Stocks In Focus: Oklo And 5E Advanced Materials,131000557,https://static.seekingalpha.com/cdn/s3/uploads/getty_images/2149338306/image_2149338306.jpg?io=getty-c-w1536,MSFT,SeekingAlpha,"Read more on the latest developments in the decarbonization sector, including the rising stocks of nuclear reactor developer Oklo and 5E Advanced Materials.",https://finnhub.io/api/news?id=64e354194f7ddcb0c71caac1a21bb1561c91592db67ae181aca03ae6431ac8e8,MSFT,2024-11-02 06:11:27
company,1730526649,Microsoft Q1: A Rare Buying Opportunity Emerges,130999963,https://static.seekingalpha.com/cdn/s3/uploads/getty_images/1369567912/image_1369567912.jpg?io=getty-c-w1536,MSFT,SeekingAlpha,"Read here for an analysis of Microsoft's FY1Q25 earnings report, with a focus on Azure's growth, supply constraints, and potential for reacceleration in 2H.",https://finnhub.io/api/news?id=0956b0705992995f2c2c4a9adcc1a0626f920be1222951dbfec699cee980493f,MSFT,2024-11-02 05:50:49
company,1730521189,Buy 3 November Dogs Of The Dow And Watch 7 More,130996975,https://static.seekingalpha.com/cdn/s3/uploads/getty_images/1066730046/image_1066730046.jpg?io=getty-c-w1536,MSFT,SeekingAlpha,"Analysis of Dow stocks including highest-yield picks and top performers, showing potential gains and sector representation. Read more here.",https://finnhub.io/api/news?id=2547bcabead844f4b967b440f5f9fea03806064e6e25ca561f757371edf43bc5,MSFT,2024-11-02 04:19:49
company,1730515500,The Noisiest 10 Days Of The Year,130994256,https://static.seekingalpha.com/cdn/s3/uploads/getty_images/1397937755/image_1397937755.jpg?io=getty-c-w1536,MSFT,SeekingAlpha,"So far, at least, there hasnât been much to alter the longstanding market narrative of a soft landing with the continuation of the growth cycle at a more moderate pace.",https://finnhub.io/api/news?id=0d7a99c1f7068842e2b66f05da97af02c3fc9984be5b3e4f22d9133488eef2f9,MSFT,2024-11-02 02:45:00
company,1730488893,US Power Regulator Sees Data Centers as Critical Opportunity,130971058,https://s.yimg.com/ny/api/res/1.2/H9GDbxibEVqwqEcMBq.HhA--/YXBwaWQ9aGlnaGxhbmRlcjt3PTEyMDA7aD04MDA-/https://media.zenfs.com/en/bloomberg_markets_842/d6e91a3a2c28c00c31147899f907ac54,MSFT,Yahoo,"(Bloomberg) -- Supporting the development of data centers — including providing the enormous amounts of electricity they require — is a matter of national security, a top federal energy regulator said.Most Read from BloombergIs Denver’s Big Bet on E-Bikes Paying Off?The Answer To Making Cities More Family-Friendly? CourtyardsChicago Mayor Seeks Property Tax Hike, Breaking Campaign VowIstanbul Tries Free Public Transit to Help Job SeekersIn Warsaw, Falling Road Deaths Signal a Traffic Safety Turn",https://finnhub.io/api/news?id=9ce4e0349b3807b318d4507b5515611dd2cf6c5f28ef6604a24e28b62fabf41b,MSFT,2024-11-01 19:21:33
company,1730486095,What We Learned About AI From This Week's Big Tech Earnings,130967394,https://www.investopedia.com/thmb/ncsxAFFCachBgfqCrnPT6adypF0=/1500x0/filters:no_upscale():max_bytes(150000):strip_icc()/AppleMicrosoftGoogleAmazongandMetaCollage-0bbd5fc9726849e2969a09a1b2e75ce9.jpg,MSFT,Yahoo,"Big Tech's AI boom is still on, based on this week's reports from the five tech giants, cumulatively valued at more than $10 trillion, to report their latest quarterly results.",https://finnhub.io/api/news?id=525833f3cec2cd11316bfcf86627541a373c590925c7a4e113dd37cd16de4f62,MSFT,2024-11-01 18:34:55
company,1730485345,"Amazon, Google show profit growth can quiet fears over heavy AI spending",130967397,https://s.yimg.com/ny/api/res/1.2/SD7wa36TopwKndd7pHJKYw--/YXBwaWQ9aGlnaGxhbmRlcjt3PTEyMDA7aD03NTc-/https://s.yimg.com/os/creatr-uploaded-images/2023-06/b33e1b70-1064-11ee-bce3-8b6da03f7ee4,MSFT,Yahoo,Two tech giants offered an AI-era playbook for making investors wait patiently for returns.,https://finnhub.io/api/news?id=ff8bcfbba2108828ba197b4f4693d3dd7d2bc8322a9ce1310d904080416e17de,MSFT,2024-11-01 18:22:25
company,1730484420,"Microsoft, Amazon or Alphabet: Who Is Winning the Cloud Race?",130971070,https://media.zenfs.com/en/zacks.com/53d9a3fd304ab73d580828e5367313eb,MSFT,Yahoo,"Microsoft, Alphabet and Amazon all reported earnings this week offering insight into business performance",https://finnhub.io/api/news?id=a35583094744f4855894eec9b6390aa5cc121d3022a54e5072c69d92b0f32a72,MSFT,2024-11-01 18:07:00
company,1730484360,Amazon’s Big Spending Is Getting a Pass From Investors. Here’s Why.,130971071,https://s.yimg.com/ny/api/res/1.2/RaXRz1Uze1OBPbVj3xklkA--/YXBwaWQ9aGlnaGxhbmRlcjt3PTEyMDA7aD02MDA-/https://media.zenfs.com/en/Barrons.com/57bdaaf8206d74e258022ca3f8a8db0d,MSFT,Yahoo,The online retailer estimates its capital spending will total approximately $75 billion in capex in 2024.,https://finnhub.io/api/news?id=4362fbdb674c6bb7a90a182666e282a4eaa1e004dc015efe8b0e8104ee6890c9,MSFT,2024-11-01 18:06:00
company,1730483100,ChatGPT: Everything you need to know about the AI-powered chatbot,130966853,https://techcrunch.com/wp-content/uploads/2023/03/GettyImages-1462188043-e1686340799615.jpg?w=1200,MSFT,Yahoo,"ChatGPT, OpenAI’s text-generating AI chatbot, has taken the world by storm since its launch in November 2022. What started as a tool to hyper-charge productivity through writing essays and code with short text prompts has evolved into a behemoth used by more than 92% of Fortune 500 companies. That growth has propelled OpenAI itself into becoming one of the most-hyped companies in recent memory. And its latest partnership with Apple for its upcoming generative AI offering, Apple Intelligence, has",https://finnhub.io/api/news?id=13c47dc33dd9027125eb5cba9772a3385095fe649f026cb2e27ad161a806aef8,MSFT,2024-11-01 17:45:00
company,1730479740,"If You'd Invested $1,000 in Apple Stock 10 Years Ago, Here's How Much You'd Have Today",130966872,https://g.foolcdn.com/editorial/images/795609/gettyimages-1043657526.jpg,MSFT,Yahoo,Apple has delivered incredible returns for long-term investors.,https://finnhub.io/api/news?id=5d37ed8e77b913c08a7a205e1bc079b06b867219fbaa55d13db752b46e49ec43,MSFT,2024-11-01 16:49:00
company,1730478474,"Stock Market Retreats Before Election Day; Microsoft, Apple, Amazon, Google, Meta In Focus: Weekly Review",130960480,,MSFT,Yahoo,"The stock market retreated this week amid earnings from Microsoft, Amazon, Meta, Apple, Google and many more, along with preelection jitters.",https://finnhub.io/api/news?id=23b63920b563cf62680003524cf57771ee2ac06fa14112a128801eae0e0db9bc,MSFT,2024-11-01 16:27:54
company,1730474496,"Microsoft Corporation (MSFT) Reports Strong Q1 Earnings with $65.6 Billion Revenue, Driven by Cloud Growth and AI, But Guidance Falls Short of Expectations",130960482,https://s.yimg.com/ny/api/res/1.2/Ehrz1CBybY_oskwS2bSRJQ--/YXBwaWQ9aGlnaGxhbmRlcjt3PTEyMDA7aD02NzM-/https://media.zenfs.com/en/insidermonkey.com/ae3cb2a93ad8e5ddf6f94148e71f74b9,MSFT,Yahoo,"We recently compiled a list of the 15 AI News Investors Should Not Miss. In this article, we are going to take a look at where Microsoft Corporation (NASDAQ:MSFT) stands against the other AI stocks investors should not miss. On October 31, CNBC’s Steve Kovach joined ‘Money Movers’ to discuss big tech’s AI spending. Kovach observes […]",https://finnhub.io/api/news?id=ea8c927b75befbff26c36f6c81e62c99c4b46d5cb3579cd350da410e41ecd201,MSFT,2024-11-01 15:21:36
company,1730468700,Billionaire Ken Griffin Has Been Quietly Selling Microsoft and Buying This Chip Stock Instead. (Hint: It's not Nvidia.),130954573,https://g.foolcdn.com/editorial/images/795599/gettyimages-1414874188.jpg,MSFT,Yahoo,"Griffin's hedge fund, Citadel, has been steadily selling Microsoft for the last year while buying shares of Taiwan Semiconductor.",https://finnhub.io/api/news?id=b5c3e18d4e669a7e3753358ef9a059d9d0c5185d075b0886368ef1726c2503f6,MSFT,2024-11-01 13:45:00
company,1730468107,"Amazon Reassures Investors With Cloud Growth, Cost-Cutting",130971092,https://s.yimg.com/ny/api/res/1.2/NydVz11OCw4GJkFIEnvJrQ--/YXBwaWQ9aGlnaGxhbmRlcjt3PTEyMDA7aD04MDA-/https://media.zenfs.com/en/bloomberg_markets_842/14a6b51f37d4e00325d197b86a8aac88,MSFT,Yahoo,"(Bloomberg) -- Amazon.com Inc. reported strong results that showed a company humming on all cylinders, a testament to its efforts to cut and reallocate costs and put the cloud computing and e-commerce giant on sounder footing.Most Read from BloombergIs Denver’s Big Bet on E-Bikes Paying Off?The Answer To Making Cities More Family-Friendly? CourtyardsChicago Mayor Seeks Property Tax Hike, Breaking Campaign VowIstanbul Tries Free Public Transit to Help Job SeekersIn Warsaw, Falling Road Deaths Sig",https://finnhub.io/api/news?id=df5a7d6fa6b326a98d2b72b8da5d2d25f6603721fd4e520b03d0a443262f7d87,MSFT,2024-11-01 13:35:07
company,1730386827,Amazon stock pops after Q3 earnings beat,130914094,https://s.yimg.com/ny/api/res/1.2/2q6E37_RooJzbSEyNTBVtw--/YXBwaWQ9aGlnaGxhbmRlcjt3PTEyMDA7aD03NTE-/https://s.yimg.com/os/creatr-uploaded-images/2024-10/d913b8c0-96da-11ef-bfff-b08d46196f7d,MSFT,Yahoo,Amazon reported third quarter earnings on Thursday amid a volatile week for big tech stocks.,https://finnhub.io/api/news?id=29f121bde7c88944bd45d132d976d124ec5268f86814a3229cf4afc8617dcc0e,MSFT,2024-10-31 15:00:27
company,1730465584,AWS earnings round out a quarter of hyperscaler AI wins,130971094,https://imgproxy.divecdn.com/5fG2rEQqjqtqK_NTPuVh8eH9FzHmTFM2NsvATaaSlWY/g:ce/rs:fit:770:435/Z3M6Ly9kaXZlc2l0ZS1zdG9yYWdlL2RpdmVpbWFnZS9JTUdfODY5MC5qcGc=.webp,MSFT,Yahoo,"The company cited AI demand as a driver of enterprise cloud consumption, a clear trend among large vendors.",https://finnhub.io/api/news?id=75e1de26a2601aebfacc9f37bdc8fe32b94784c88af90bae25d6e0d63825b15b,MSFT,2024-11-01 12:53:04
company,1730465271,"Trending tickers: Apple, Amazon, Nvidia, Intel and Microsoft",130953184,https://s.yimg.com/ny/api/res/1.2/Zluj.tv1NJNFvAj0HZYsUQ--/YXBwaWQ9aGlnaGxhbmRlcjt3PTEyMDA7aD04NzQ-/https://s.yimg.com/os/creatr-uploaded-images/2024-10/e5552140-984d-11ef-b789-24079c56fee2,MSFT,Yahoo,"The health of the tech industry and its links to AI is in focus, with computing giants and chip manufacturers reporting results.",https://finnhub.io/api/news?id=72d1ed328190be91e3896a05c70d64715bdf62824d9d201f42cb1dac6fc345f6,MSFT,2024-11-01 12:47:51
company,1730465040,Big Tech's AI spending spree has Wall Street worried,130953186,https://media.zenfs.com/en/quartz.com/3b562306d3fa5273d94e8d76974ee77f,MSFT,Yahoo,"For tech’s biggest players, this earnings season is starting to feel like a scene from the movie Jerry Maguire — and the “show me the money” demands aren’t working out any better than they did for Tom Cruise. Some analysts are even dubbing this the “show me the money” quarter, as Wall Street’s patience with massive AI spending begins to wear thin.",https://finnhub.io/api/news?id=9adb02cc9b708a09d99654950a7d0d2f94f38520db459f757d6d86c904c51c0b,MSFT,2024-11-01 12:44:00
company,1730461500,Billionaire Bill Gates Has 69% of His Foundation's $49 Billion Portfolio Invested in 3 Phenomenal Stocks,130953190,https://g.foolcdn.com/editorial/images/795581/getty-images-msft-microsoft-black-background.jpeg,MSFT,Yahoo,The tech billionaire has some surprisingly un-tech investments in his trust's portfolio.,https://finnhub.io/api/news?id=7006c0eb17f9d25ca6b327142ab8147819829a847c640d2581424d5ba87ebe8f,MSFT,2024-11-01 11:45:00
company,1730461500,Nvidia CEO Jensen Huang Is Bullish on Nuclear Power. Will Nvidia Invest in Nuclear Stocks?,130953188,https://g.foolcdn.com/editorial/images/795585/nuclear-power-plant.jpg,MSFT,Yahoo,Nuclear stocks are soaring. Will Nvidia join the fray?,https://finnhub.io/api/news?id=979aea8526fce20e1542e1492a58c12c87d03d1f0e8fa66536eb7cb0a8874c2a,MSFT,2024-11-01 11:45:00
company,1730459210,The Rotation Out Of Technology Should Come As No Surprise,130956592,https://static.seekingalpha.com/cdn/s3/uploads/getty_images/1283384596/image_1283384596.jpg?io=getty-c-w1536,MSFT,SeekingAlpha,The selloff in tech stocks comes as no surprise to those who anticipated the sequential decline in profits growth earlier this year. Read my market outlook here.,https://finnhub.io/api/news?id=9e55ac1332f93b60528e398cb5bdb8682997a812470cd4982d4a808eab152694,MSFT,2024-11-01 11:06:50
company,1730458522,Tech Giants Are Set to Spend $200 Billion This Year Chasing AI,130967452,https://s.yimg.com/ny/api/res/1.2/DWf0jXQmMc0j5UqQXjAR6A--/YXBwaWQ9aGlnaGxhbmRlcjt3PTEyMDA7aD03MjQ-/https://media.zenfs.com/en/bloomberg_technology_68/a047bb8d3479b389bf712b2ac4f2c1da,MSFT,Yahoo,"(Bloomberg) -- Three months ago, Wall Street punished the world’s largest technology firms for spending enormous amounts to develop artificial intelligence, only to deliver results that failed to justify the costs.Most Read from BloombergIs Denver’s Big Bet on E-Bikes Paying Off?The Answer To Making Cities More Family-Friendly? CourtyardsChicago Mayor Seeks Property Tax Hike, Breaking Campaign VowIstanbul Tries Free Public Transit to Help Job SeekersNY Transit Agency Takes Next Step on Brooklyn-",https://finnhub.io/api/news?id=438d520622b0e7c5397802b630cb11dea2745732f805c11a69c738d96129192a,MSFT,2024-11-01 10:55:22
company,1730456503,Q3 2024 WEC Energy Group Inc Earnings Call,130953193,https://s.yimg.com/cv/apiv2/social/images/yahoo_default_logo-1200x1200.png,MSFT,Yahoo,Q3 2024 WEC Energy Group Inc Earnings Call,https://finnhub.io/api/news?id=f04a28d7492a8666ab6af41b75d0a0d5d4b91602375aff184a2f30a13122213e,MSFT,2024-11-01 10:21:43
company,1730456251,CISA warns of foreign threat group launching spearphishing campaign using malicious RDP files,130960498,https://imgproxy.divecdn.com/lOTZWEAa-qBhj9mFkm6KJe4EoY61MZ1c-SosXs9IeVg/g:ce/rs:fit:770:435/bG9jYWw6Ly8vZGl2ZWltYWdlL0NJU0FfaGVhZGVyLmpwZw==.webp,MSFT,Yahoo,"Midnight Blizzard has targeted more than 100 organizations across government, IT and academia, in some cases impersonating Microsoft employees.",https://finnhub.io/api/news?id=2803b5b3ee93a1debe09df8fa28ee82ac9c1232b47a8277f6d6494da9cb6e0b7,MSFT,2024-11-01 10:17:31
company,1730455500,Prediction: 1 Stock That'll Be Worth More Than Nvidia 5 Years From Now,130950397,https://g.foolcdn.com/editorial/images/792336/person-with-a-computer-and-dollar-bills-flying-around.jpg,MSFT,Yahoo,"Nvidia is capturing attention right now, but a lot can happen in five years.",https://finnhub.io/api/news?id=7f8fb82eebcb9c7060dab006ef3c7117ae5e52e8e317c00ee2cfbe65c1068198,MSFT,2024-11-01 10:05:00
company,1730455226,"US Cyber Chief Trying to Get Americans to Trust Her, and Election",130955636,https://s.yimg.com/ny/api/res/1.2/hcLYCTV.lRbmdRtA0gHWLw--/YXBwaWQ9aGlnaGxhbmRlcjt3PTEyMDA7aD04MDA-/https://media.zenfs.com/en/bloomberg_technology_68/870f4decb4c66e984da96d417a1528b0,MSFT,Yahoo,"(Bloomberg) -- As director of the Cybersecurity and Infrastructure Security Agency, Jen Easterly helps protect election infrastructure from hacks, violence and bad faith claims intended to stoke mistrust.Most Read from BloombergIs Denver’s Big Bet on E-Bikes Paying Off?The Answer To Making Cities More Family-Friendly? CourtyardsChicago Mayor Seeks Property Tax Hike, Breaking Campaign VowNY Transit Agency Takes Next Step on Brooklyn-Queens Rail LinkIstanbul Tries Free Public Transit to Help Job S",https://finnhub.io/api/news?id=b5615985c8a31621a77fe4002124aa5f948334cfe5f799a74438fec133f74e56,MSFT,2024-11-01 10:00:26
company,1730454300,AI Monthly: Soaring Costs Of GenAI Challenge Short-Term Profitability,130954427,https://static.seekingalpha.com/cdn/s3/uploads/getty_images/1495482210/image_1495482210.jpg?io=getty-c-w1536,MSFT,SeekingAlpha,"New data suggests that AI is driving innovation and discovery beyond the ICT sector. This is a promising sign, but there are growing concerns about the short-term returns on AI investments.",https://finnhub.io/api/news?id=c8dc54d70adf2ae6c7e20f2dd9c665a0de0fe5355801bdfeebcd33e21977b3de,MSFT,2024-11-01 09:45:00
company,1730454240,"Is Google Parent Alphabet the Best ""Magnificent Seven"" Stock to Buy Right Now?",130948950,https://g.foolcdn.com/editorial/images/796044/google-cellphone.jpg,MSFT,Yahoo,There's a lot to like about this tech giant but one reason for concern.,https://finnhub.io/api/news?id=b170b9b06320b1fc5845bcc311eb2bf888f75ca7376006f7e3c3bde3ec5a1195,MSFT,2024-11-01 09:44:00
company,1730453591,"Microsoft: Magnificent, Fairly Valued",130954084,https://static.seekingalpha.com/cdn/s3/uploads/getty_images/1421030803/image_1421030803.jpg?io=getty-c-w1536,MSFT,SeekingAlpha,"Microsoft's growth potential and strong financial position make it a less risky investment option, despite potentially high valuation concerns. Read more here.",https://finnhub.io/api/news?id=449f8f2be2050636a0b7fd482c07de361b3f5e434b739224b84aafa337ab9c0f,MSFT,2024-11-01 09:33:11
company,1730453400,AI Data Center Deep Dive - Navigating The Data Center Value Chain,130954085,https://static.seekingalpha.com/cdn/s3/uploads/getty_images/2148113350/image_2148113350.jpg?io=getty-c-w1536,MSFT,SeekingAlpha,The key driver for data center investment has been capex spending by the Cloud Service Providers. Capex growth surprised to the upside this year and we expect it to surprise again next year.,https://finnhub.io/api/news?id=597eee7e998aae63e076eae4327163261eae95971b9ef39780e58924b5d4b30b,MSFT,2024-11-01 09:30:00
company,1730452466,"AI: Nuke it, nuke it good",130953199,https://www.verdict.co.uk/wp-content/uploads/2024/11/shutterstock_2512612545.jpg,MSFT,Yahoo,"AI is worthwhile, but does its use need to be completely unrestrained, especially when our need for power is growing ever greater?",https://finnhub.io/api/news?id=bc986acec548c09409dad2f8e937f3568e3d17161bcd5786791b0131955965ff,MSFT,2024-11-01 09:14:26
company,1730451600,"ChatGPT takes on Google, Meta's spending spree, and Microsoft's data center problem: AI news roundup",130948951,https://media.zenfs.com/en/quartz.com/425485f7a9521f8fab9b6db6b802ead2,MSFT,Yahoo,"Major tech companies reported earning results this week including Microsoft and Meta. But weaker-than-expected prospects for the next quarter sent artificial intelligence stocks, including Nvidia’s (NVDA), down on Thursday.",https://finnhub.io/api/news?id=fc79fa3b19ed3e603e97f203c9511f903f303ec48b61ce8ee69bfee6b276ee63,MSFT,2024-11-01 09:00:00
company,1730449980,"Meet the Unstoppable Stock That Could Join Apple, Nvidia, and Microsoft in the $3 Trillion Club Next Year",130948953,https://g.foolcdn.com/editorial/images/795807/an-image-of-googles-office-headquarters.jpg,MSFT,Yahoo,"Alphabet faces regulatory headwinds, but its current valuation might be too attractive for investors to pass up.",https://finnhub.io/api/news?id=c6a7fd65608f2a284d1b04e5c39d1e2b07f2a533b1faa29195a437717ba3fa78,MSFT,2024-11-01 08:33:00
company,1730449920,"Meet the Supercharged Growth Stock That Could Join Apple, Nvidia, Microsoft, and Alphabet in the $2 Trillion Club by 2028",130948957,https://g.foolcdn.com/editorial/images/796105/a-business-person-looking-at-various-holograms.jpg,MSFT,Yahoo,"Semiconductors are a critical component enabling the artificial intelligence (AI) revolution, and this company holds the keys to the kingdom.",https://finnhub.io/api/news?id=6a9d887c4953b7f465ff2d9cc2fe8bae079176632ad15a4af913c145f6dfa3c0,MSFT,2024-11-01 08:32:00
company,1730449920,"This Little-Known Company Has Outpaced All Of The ""Magnificent Seven"" Stocks This Year. Here's Why I Think It's Parabolic Run Could Just Be Getting Started.",130945807,https://g.foolcdn.com/editorial/images/795450/gettyimages-613330688-1.jpg,MSFT,Yahoo,A nuclear power company has outperformed every stock in the S&P 500 so far this year.,https://finnhub.io/api/news?id=2091b883f806f18dbd7efbf5887f36a950626246742533ade7aeddc879e3066b,MSFT,2024-11-01 08:32:00
company,1730446200,Arm Stock vs. Taiwan Semiconductor Stock: Wall Street Says Buy One and Sell the Other,130944074,https://g.foolcdn.com/editorial/images/795891/bull-and-bear-2.jpg,MSFT,Yahoo,"Arm and Taiwan Semiconductor are essential to the artificial intelligence boom, but Wall Street only sees upside in one stock.",https://finnhub.io/api/news?id=6b04e5edb11131013e971a34cea5f8c227debc245f20d9af49db6e7cc76b2941,MSFT,2024-11-01 07:30:00
company,1730431451,Q3 2024 Gannett Co Inc Earnings Call,130934040,,MSFT,Yahoo,Q3 2024 Gannett Co Inc Earnings Call,https://finnhub.io/api/news?id=544b0b90555ef1a69087685bc2468f03d0afbca987272a36bce5529afc9b2a33,MSFT,2024-11-01 03:24:11
company,1730429569,Microsoft: Expensive AI Tailwinds,130942198,https://static.seekingalpha.com/cdn/s3/uploads/getty_images/1509310383/image_1509310383.jpg?io=getty-c-w1536,MSFT,SeekingAlpha,"We see Microsoft as fairly valued with limited upside potential, but recommend Meta Platforms and Google for deeper value. Read more on these stocks here.",https://finnhub.io/api/news?id=93c4dd956f0431d42e88ad2877c417df7e40c79aea55a51601a090732b059233,MSFT,2024-11-01 02:52:49
company,1730415414,Amazon CEO Says GenAI Is Growing Three Times Faster Than Cloud Computing Did,130926740,https://www.investopedia.com/thmb/fkfdQfd9rqnIrX2JdGLAxLY4Ogg=/1500x0/filters:no_upscale():max_bytes(150000):strip_icc()/GettyImages-1445867611-c9524f32b691406cb3797a2d8a005fc8.jpg,MSFT,Yahoo,The growth of generative artificial intelligence businesses is surprising even the tech industry’s most seasoned executives.,https://finnhub.io/api/news?id=51947d0de87a25b2175287818d861b6f0824ef0e2bad794ffcb87946047f09be,MSFT,2024-10-31 22:56:54
company,1730410080,"ChatGPT's New Web Search Tools Bring Live Updates, News Alliances With Microsoft's Support",130934048,https://media.zenfs.com/en/us.finance.gurufocus/10a2c805766adf82de2d7cc2e32af21b,MSFT,Yahoo,"OpenAI expands ChatGPT with new web search tools, offering real-time data from trusted sources like Reuters and AP",https://finnhub.io/api/news?id=ef778f42ad9ec3fbf6a06939624c214cc3f79dc61d1c9dd019b495c590853244,MSFT,2024-10-31 21:28:00
company,1730409627,Apple sales climb but Chinese business shrinks,130921868,https://www.telegraph.co.uk/content/dam/business/2024/10/31/TELEMMGLPICT000350294677_17304093537980_trans_NvBQzQNjv4BqpVlberWd9EgFPZtcLiMQf0Rf_Wk3V23H2268P_XkPxc.jpeg?impolicy=Twitter-Live,MSFT,Yahoo,"Apple’s sales have grown at the fastest pace for two years amid growing demand for its new iPhones, although the tech giant continued to struggle in China.",https://finnhub.io/api/news?id=abd5ac7675f47c694ac0da51cbf2684d62623cddd7831461eb29dbef60389708,MSFT,2024-10-31 21:20:27
company,1730366640,"Nvidia Stock Falls. Why Meta, Microsoft Earnings Are Giving Investors a Halloween Fright.",130897089,,MSFT,Yahoo,Investors are fretting about how long the AI boom can last after the Big Tech companies forecast that their capital spending will carry on rising.,https://finnhub.io/api/news?id=791f912c7e87da64173f2453a3ef1f8103e22546f1b557383dad19a2ae96988a,MSFT,2024-10-31 09:24:00
company,1730409333,"Dow, S&P 500 Snap Five-Month Winning Streaks",130921871,https://media.zenfs.com/en/mt_newswires_premium_news_706/0c887a492733aab96ac405a5871f559a,MSFT,Yahoo,"Dow, S&P 500 Snap Five-Month Winning Streaks",https://finnhub.io/api/news?id=2f6262f8fc00ab0665f99264ae75bab2968f7ae463de7d3a1c4d80f96c3b8778,MSFT,2024-10-31 21:15:33
